{"contract":"av-support-diagnostic-v1","generated_at_utc":"2026-08-01T10:00:00Z","core_version":"1.0.0","module_id":"mail_processing","module_version":"1.0.0","module_schema_version":1,"profile_id":"demo_dhl","environment":"development","timezone":"Europe/Berlin","storage_schema_version":2,"counters":{"shifts":2,"work_items":4,"activities":3,"corrections":1,"audit_events":12,"import_warnings":0}}
